{
    "format": "lumisite.session",
    "formatVersion": "0.1.0",
    "exportedUtcMs": 1700000020000,
    "generator": "lumisite core ExampleGenerator (synthetic)",
    "site": {
        "id": "site-1",
        "name": "Exemple synthétique",
        "origin": {
            "lat": 48.8566,
            "lon": 2.3522
        },
        "originSource": "COORDINATES",
        "createdUtcMs": 1700000000000,
        "crs": [
            {
                "id": "SITE_ENU",
                "kind": "LOCAL_TANGENT_PLANE_ENU",
                "definition": "+proj=topocentric +ellps=WGS84 +lat_0=48.8566 +lon_0=2.3522 +h_0=0.0",
                "origin": {
                    "lat": 48.8566,
                    "lon": 2.3522
                },
                "axes": [
                    "E (x, east)",
                    "N (y, north)",
                    "U (z, up)"
                ],
                "units": "m"
            }
        ],
        "plans": [],
        "notes": "SYNTHETIC example: values are invented, not measured"
    },
    "session": {
        "id": "sess-1",
        "siteId": "site-1",
        "name": "Exemple synthétique",
        "createdUtcMs": 1700000000000,
        "device": {
            "id": "dev-1",
            "manufacturer": "ACME",
            "model": "Tab",
            "osVersion": "14",
            "appVersion": "0.1.0",
            "arSupport": "SUPPORTED",
            "sensors": []
        },
        "timeBases": [
            {
                "id": "tb-1",
                "deviceId": "dev-1",
                "clock": "ANDROID_ELAPSED_REALTIME_NANOS",
                "referenceUtcEpochMs": 1700000000000,
                "referenceMonotonicNs": 5000000000
            }
        ],
        "localFrame": {
            "id": "AR_SESSION",
            "kind": "ARCORE_WORLD",
            "definition": "y up, metres",
            "axes": [],
            "units": "m"
        }
    },
    "events": [
        {
            "type": "session_started",
            "id": "evt-start",
            "t": {
                "utcEpochMs": 1700000000000,
                "monotonicNs": 5000000000,
                "timeBaseId": "tb-1"
            },
            "note": "SYNTHETIC example generated by ExampleGenerator.kt"
        },
        {
            "type": "tracking_state",
            "id": "evt-trk-init",
            "t": {
                "utcEpochMs": 1700000000050,
                "monotonicNs": 5050000000,
                "timeBaseId": "tb-1"
            },
            "state": "INITIALIZING"
        },
        {
            "type": "tracking_state",
            "id": "evt-trk-ok",
            "t": {
                "utcEpochMs": 1700000000900,
                "monotonicNs": 5900000000,
                "timeBaseId": "tb-1"
            },
            "state": "TRACKING"
        },
        {
            "type": "tracking_state",
            "id": "evt-trk-deg",
            "t": {
                "utcEpochMs": 1700000008000,
                "monotonicNs": 13000000000,
                "timeBaseId": "tb-1"
            },
            "state": "DEGRADED",
            "reason": "INSUFFICIENT_FEATURES"
        },
        {
            "type": "tracking_state",
            "id": "evt-trk-ok2",
            "t": {
                "utcEpochMs": 1700000008500,
                "monotonicNs": 13500000000,
                "timeBaseId": "tb-1"
            },
            "state": "TRACKING"
        },
        {
            "type": "calibration",
            "id": "evt-cal-1",
            "t": {
                "utcEpochMs": 1700000001000,
                "monotonicNs": 6000000000,
                "timeBaseId": "tb-1"
            },
            "method": "ONE_POINT_HEADING",
            "observations": [
                {
                    "pose": {
                        "t": {
                            "utcEpochMs": 1700000001000,
                            "monotonicNs": 6000000000,
                            "timeBaseId": "tb-1"
                        },
                        "p": [
                            0.0,
                            1.4,
                            -0.0
                        ],
                        "q": [
                            0.0,
                            0.0,
                            0.0,
                            1.0
                        ],
                        "tracking": "TRACKING",
                        "source": "ARCORE_CAMERA_POSE"
                    },
                    "reference": {
                        "label": "Entrée",
                        "site": {
                            "e": 3.0,
                            "n": 2.0,
                            "u": 0.0
                        },
                        "latLon": {
                            "lat": 48.8566,
                            "lon": 2.3522
                        },
                        "source": "MAP_TAP",
                        "uncertaintyM": 1.0
                    }
                }
            ],
            "headingDeg": 15.0,
            "headingSource": "MANUAL",
            "headingUncertaintyDeg": 5.0,
            "transform": {
                "scale": 1.0,
                "rotationRad": -0.26179938779914935,
                "tx": 3.0,
                "ty": 2.0
            },
            "scaleFixed": true,
            "residualM": 0.0
        },
        {
            "type": "sync",
            "id": "evt-sync-1",
            "t": {
                "utcEpochMs": 1700000001500,
                "monotonicNs": 6500000000,
                "timeBaseId": "tb-1"
            },
            "syncCode": "S1",
            "method": "MANUAL_TAP",
            "role": "PARTICIPANT",
            "eventMonotonicNs": 6500000000,
            "notes": "synthetic"
        },
        {
            "type": "survey",
            "id": "evt-survey-1",
            "t": {
                "utcEpochMs": 1700000004000,
                "monotonicNs": 9000000000,
                "timeBaseId": "tb-1"
            },
            "kind": "LUMINAIRE",
            "note": "Applique murale",
            "pose": {
                "t": {
                    "utcEpochMs": 1700000004000,
                    "monotonicNs": 9000000000,
                    "timeBaseId": "tb-1"
                },
                "p": [
                    0.06705600040299337,
                    1.4,
                    -3.0
                ],
                "q": [
                    0.0,
                    0.0,
                    0.0,
                    1.0
                ],
                "tracking": "TRACKING",
                "source": "ARCORE_CAMERA_POSE"
            },
            "tracking": "TRACKING",
            "positionSource": "AR_POSE",
            "attachments": [],
            "dxf": {
                "layer": "ECL_LUMINAIRES",
                "blockName": "LUM_GENERIC",
                "attributes": {
                    "NOTE": "Applique murale"
                }
            }
        },
        {
            "type": "survey",
            "id": "evt-survey-2",
            "t": {
                "utcEpochMs": 1700000007000,
                "monotonicNs": 12000000000,
                "timeBaseId": "tb-1"
            },
            "kind": "LUMINAIRE",
            "note": "Projecteur encastré",
            "pose": {
                "t": {
                    "utcEpochMs": 1700000007000,
                    "monotonicNs": 12000000000,
                    "timeBaseId": "tb-1"
                },
                "p": [
                    0.1060292250900537,
                    1.4,
                    -6.0
                ],
                "q": [
                    0.0,
                    0.0,
                    0.0,
                    1.0
                ],
                "tracking": "TRACKING",
                "source": "ARCORE_CAMERA_POSE"
            },
            "tracking": "TRACKING",
            "positionSource": "AR_POSE",
            "attachments": [],
            "dxf": {
                "layer": "ECL_LUMINAIRES",
                "blockName": "LUM_GENERIC",
                "attributes": {
                    "NOTE": "Projecteur encastré"
                }
            }
        },
        {
            "type": "survey",
            "id": "evt-survey-3",
            "t": {
                "utcEpochMs": 1700000011000,
                "monotonicNs": 16000000000,
                "timeBaseId": "tb-1"
            },
            "kind": "LUMINAIRE",
            "note": "Luminaire de sortie",
            "pose": {
                "t": {
                    "utcEpochMs": 1700000011000,
                    "monotonicNs": 16000000000,
                    "timeBaseId": "tb-1"
                },
                "p": [
                    0.1727989444555315,
                    1.4,
                    -10.0
                ],
                "q": [
                    0.0,
                    0.0,
                    0.0,
                    1.0
                ],
                "tracking": "TRACKING",
                "source": "ARCORE_CAMERA_POSE"
            },
            "tracking": "TRACKING",
            "positionSource": "AR_POSE",
            "attachments": [],
            "dxf": {
                "layer": "ECL_LUMINAIRES",
                "blockName": "LUM_GENERIC",
                "attributes": {
                    "NOTE": "Luminaire de sortie"
                }
            }
        },
        {
            "type": "relocalization",
            "id": "evt-reloc-1",
            "t": {
                "utcEpochMs": 1700000012500,
                "monotonicNs": 17500000000,
                "timeBaseId": "tb-1"
            },
            "observation": {
                "pose": {
                    "t": {
                        "utcEpochMs": 1700000012500,
                        "monotonicNs": 17500000000,
                        "timeBaseId": "tb-1"